{
  "$schema": "https://json-schema.org/draft/2020-12/schema",
  "$id": "https://autonomous-coding-agent.local/schemas/readiness-report.schema.json",
  "title": "Readiness Report Schema",
  "description": "Schema for the machine-readable final readiness report emitted at the deterministic final gate. This shape is derived from canonical-architecture.md Sections 5.8, 9.1, 10.5, 19, and 20 plus IMPLEMENTATION-PLAN.md reports.py requirements. Open question: this schema includes `run_state` directly on the readiness report for v1 normalization, but a later implementation may choose to move it into a separate supervisor run-summary object.",
  "type": "object",
  "additionalProperties": false,
  "required": [
    "run_id",
    "claim_id",
    "run_trace_id",
    "strategy_name",
    "run_state",
    "readiness_verdict",
    "builder_turns",
    "run_duration_seconds",
    "total_cost_dollars",
    "phases_completed",
    "commands_run",
    "failures",
    "changed_files",
    "artifact_manifest",
    "unresolved_blockers",
    "queue_entry_reason",
    "queue_exit_reason"
  ],
  "properties": {
    "run_id": {
      "type": "string",
      "description": "Run identifier from canonical-architecture.md Section 20 \"Machine-readable report\"."
    },
    "claim_id": {
      "type": [
        "string",
        "null"
      ],
      "description": "Queue claim identifier required by RULES.md reporting rules. Non-queue runs may emit null."
    },
    "run_trace_id": {
      "type": "string",
      "description": "Trace identifier used to correlate reports, logs, and artifacts, from RULES.md trace-correlation rules."
    },
    "strategy_name": {
      "type": "string",
      "description": "Supervisor strategy label used for benchmark/eval comparisons when prompts or autonomy boundaries change."
    },
    "run_state": {
      "type": "string",
      "enum": [
        "COMPLETE",
        "BLOCKED",
        "UNSUPPORTED",
        "IN_PROGRESS"
      ],
      "description": "Supervisor-level run_state from canonical-architecture.md Section 9.1 \"Terminal States and Readiness Verdict\"."
    },
    "readiness_verdict": {
      "type": [
        "string",
        "null"
      ],
      "enum": [
        "READY",
        "NOT_READY",
        "NEEDS_MORE_EVIDENCE",
        null
      ],
      "description": "Final-gate readiness_verdict from canonical-architecture.md Section 9.1 \"Terminal States and Readiness Verdict\"."
    },
    "builder_turns": {
      "type": "integer",
      "minimum": 0,
      "description": "Number of builder turns consumed during the run, retained for benchmark grading and prompt comparisons."
    },
    "run_duration_seconds": {
      "type": "number",
      "minimum": 0,
      "description": "Wall-clock runtime for the run, retained for benchmark grading and prompt comparisons."
    },
    "total_cost_dollars": {
      "type": "number",
      "minimum": 0,
      "description": "Total strategy-layer cost recorded for the run, retained for benchmark grading and prompt comparisons."
    },
    "phases_completed": {
      "type": "array",
      "description": "Completed phases from canonical-architecture.md Section 20.",
      "items": {
        "type": "string"
      }
    },
    "commands_run": {
      "type": "array",
      "description": "Machine-readable command execution summaries. IMPLEMENTATION-PLAN.md Phase 1 reports.py and verifier guidance name command name, exit code, stdout, stderr, duration, and failure fingerprint as captured execution fields.",
      "items": {
        "type": "object",
        "additionalProperties": false,
        "required": [
          "name",
          "exit_code",
          "stdout",
          "stderr",
          "duration_seconds"
        ],
        "properties": {
          "name": {
            "type": "string",
            "description": "Executed contract or verification command name, from IMPLEMENTATION-PLAN.md Phase 1."
          },
          "exit_code": {
            "type": "integer",
            "description": "Process exit code, from IMPLEMENTATION-PLAN.md Phase 1 verifier capture guidance."
          },
          "stdout": {
            "type": "string",
            "description": "Captured stdout, from IMPLEMENTATION-PLAN.md Phase 1 verifier capture guidance."
          },
          "stderr": {
            "type": "string",
            "description": "Captured stderr, from IMPLEMENTATION-PLAN.md Phase 1 verifier capture guidance."
          },
          "duration_seconds": {
            "type": "number",
            "description": "Execution duration, from IMPLEMENTATION-PLAN.md Phase 1 verifier capture guidance."
          },
          "failure_fingerprint": {
            "type": "string",
            "description": "Optional linked failure fingerprint, from IMPLEMENTATION-PLAN.md Phase 1 verifier capture guidance."
          }
        }
      }
    },
    "failures": {
      "type": "array",
      "description": "Failures encountered during the run, as required by canonical-architecture.md Section 20. Open question: the docs do not yet settle whether these entries should be strings, defect packet refs, or embedded fingerprint objects.",
      "items": {
        "type": "string"
      }
    },
    "changed_files": {
      "type": "array",
      "description": "Changed file paths from canonical-architecture.md Section 20.",
      "items": {
        "type": "string"
      }
    },
    "checkpoint_refs": {
      "type": "array",
      "description": "Optional checkpoint references from canonical-architecture.md Section 20. RULES.md marks this field optional in the smallest v1.",
      "items": {
        "type": "string"
      }
    },
    "artifact_manifest": {
      "type": "array",
      "description": "Artifact manifest entries from canonical-architecture.md Section 20. Open question: the docs name artifact_manifest but do not yet define a structured manifest entry object, so v1 stores a normalized list of artifact paths.",
      "items": {
        "type": "string"
      }
    },
    "unresolved_blockers": {
      "type": "array",
      "description": "Unresolved blockers present at final gate, from canonical-architecture.md Section 20 and PROMPTS.md final readiness audit constraints.",
      "items": {
        "type": "string"
      }
    },
    "queue_entry_reason": {
      "type": [
        "string",
        "null"
      ],
      "description": "Why the run entered the queue or supervisor intake path, from RULES.md reporting rules."
    },
    "queue_exit_reason": {
      "type": [
        "string",
        "null"
      ],
      "description": "Why the run exited the queue or terminalized, from RULES.md reporting rules."
    }
  },
  "examples": [
    {
      "run_id": "benchmark-001",
      "claim_id": "claim-001",
      "run_trace_id": "trace-001",
      "strategy_name": "simple",
      "run_state": "COMPLETE",
      "readiness_verdict": "READY",
      "builder_turns": 2,
      "run_duration_seconds": 18.2,
      "total_cost_dollars": 0.0,
      "phases_completed": [
        "INTAKE",
        "PREPARE_WORKSPACE",
        "BUILD",
        "LOCAL_VERIFY",
        "FINAL_GATE"
      ],
      "commands_run": [
        {
          "name": "test",
          "exit_code": 0,
          "stdout": "all tests passed",
          "stderr": "",
          "duration_seconds": 12.4
        }
      ],
      "failures": [],
      "changed_files": [
        "src/api/users.ts",
        "tests/users.test.ts"
      ],
      "artifact_manifest": [
        "artifacts/logs/test.txt",
        "reports/final-summary.md"
      ],
      "unresolved_blockers": [],
      "queue_entry_reason": "Ready for Build queue claim",
      "queue_exit_reason": "final gate ready"
    },
    {
      "run_id": "benchmark-004",
      "claim_id": "claim-004",
      "run_trace_id": "trace-004",
      "strategy_name": "claude",
      "run_state": "BLOCKED",
      "readiness_verdict": "NOT_READY",
      "builder_turns": 3,
      "run_duration_seconds": 64.9,
      "total_cost_dollars": 0.143211,
      "phases_completed": [
        "INTAKE",
        "PREPARE_WORKSPACE",
        "BUILD",
        "LOCAL_VERIFY",
        "APP_LAUNCH",
        "UI_VERIFY",
        "FINAL_GATE"
      ],
      "commands_run": [
        {
          "name": "ui_smoke",
          "exit_code": 1,
          "stdout": "",
          "stderr": "1 test failed",
          "duration_seconds": 44.8,
          "failure_fingerprint": "settings-save-disabled-after-valid-input"
        }
      ],
      "failures": [
        "settings-save-disabled-after-valid-input"
      ],
      "changed_files": [
        "src/components/SettingsForm.tsx"
      ],
      "checkpoint_refs": [
        "[autoclaw/benchmark-004] fix: attempt settings save repair"
      ],
      "artifact_manifest": [
        "artifacts/screenshots/settings-save-disabled.png",
        "artifacts/traces/settings-flow.zip",
        "reports/final-report.json"
      ],
      "unresolved_blockers": [
        "Unresolved high-severity UI finding remains at final gate."
      ],
      "queue_entry_reason": "Ready for Build queue claim",
      "queue_exit_reason": "blocked by final gate"
    }
  ]
}
